hostile people see hostility around ready lash moment peaceful people find kindness,4
perman hater want per man want pet man india want per man india love per man india support,4
well try save job furlough scheme sadly not enough like many,4
living jesus want heal hostility toward god toward people search joy early christianity,4
feel vexed livid angry quite back fourth yes no no doubt,4
thanks warn not also could easily social distance no,4
monday morning bad share moan moanrantwhine rant whine moan moan day angry fed tweet,4
try practice technique appropriately handle situation customer may ask something,4
car dealer day dealer look fix,4
fa help get art publish come vote click want one galveston texas gal vest,4
holy shit gunpoint karen karen go wild super food angry crazy karma,4
yo father think fine go car spain colleague work mum high risk category,4
brown bias get angry make mistake question living,4
sa officially give esko no choice thing way,4
new blog entry tire angry sick not weak chronic pain angry,4
good morning twitter world good morning huma inbeing proud love love respect life angry,4
wan quick sketch sally love try show emotion sal face even tho litte,4
child abandonment charlotte atlanta charleston nc sc richmond harrisburg raleigh,4
best fighter never angry lao tzu stay safe morning good morning hospitality hotel hotelier,4
staed thread literalt ask hatred angry mad,4
sta stand comedy career purchase link,4
awesome wait see rage angry army,4
really sum month life many emotion sad angry dis point frustrate cer,4
sta stand comedy career purchase link charlotte,4
child abandonment charlotte atlanta charleston nc sc richmond harrisburg raleigh ke,4
really sum month life many emotion sad angry dis point frustrate,4
child abandonment charlotte atlanta charleston nc sc richmond harrisburg raleigh ke,4
child abandonment charlotte atlanta charleston nc sc richmond harrisburg raleigh,4
sta stand comedy career purchase link,4
waht thnk black cat catur day cat soft witter cat angry renga,4
doin angry ex aust ed hopeful america hope hick bid en trump election vote election marathon no,4
waht thnk black cat catur day cat soft witter cat angry renga,4
waht thnk black cat catur day cat soft witter cat angry renga,4
make angry cool,4
perman hater want per man want pet man india want per man india love per man india support,4
waht thnk black cat catur day cat soft witter cat angry renga,4
feed supporter always angry thought america great,4
hope not black brainwash angry racist black supremacist dey finally wakeup,4
baby boy happen generation hand identity participation trophy sacrifice noth,4
cdn saw tweet friday agenda not time special meeting must agenda,4
think let without zoom post lose great user angry disappointed,4
cdn saw tweet friday agenda not time special meeting must agen,4
feed supporter always angry thought america great usa,4
hi complaint becuase need fix app charge royalty even though exp,4
wan quick sketch sally love try show emotion sal face even tho litte,4
taco chain say closing coronavirus pandemic angry,4
yes angry people lie online previous post no longer angry,4
not angry face pet bunny face angry,4
people patriot digital soldier community want country back deep st,4
fix fuck dumbass game balance damn server someone get clip,4
storm cloud ray sun right top storm storm cloud angry dark cloud view view inst agram,4
god kind vengeful love angry welcome judgmental make huge difference,4
not rain cloud sky curtain tell rain big single regret barn bu,4
wonder much breakdown last literally tire nobody year alone sad horny angry,4
watch callums new vid tell co want angry innit,4
ffs callous nt genuinely give no cks anyone apart chum angry,4
app freeze load load give much issue send simple transaction angry,4
frustrate sad angry see professional treat second class citizen woman,4
doin angry ex aust ed hopeful america hope hick bid en trump election vote election marath,4
angry punk carp front today session love back bank fishing carp smile,4
left scene sad angry,4
hey girl heyyy mizzbettie kay tee may angry af angry hungry af hungry angry angry af angry,4
self every minute remain angry give sixty second peace emerson cle,4
not even american make angry get grip asshole tru,4
not even american make angry get grip asshole trump,4
trouble pti govt pti mnas angry govt refuse attend pm dinner angry attend dinner,4
self every minute remain angry give sixty second peace emerson cle,4
anybody else get hangry eat day hungry angry,4
beverly hill face criticism arrest peaceful protester usual hypocrisy left privilege,4
collect green bin page co wait day en charge,4
not angry face pet bunny face angry,4
collect green bin page co wait day en charge,4
whole seem collapse crazy angry people everywhere want buy,4
beverly hill face criticism arrest peaceful protester usual hypocrisy left,4
call ur parent angry stress,4
see parler go well trumper crowd password special character angry,4
thank much provide useful information angry bap uji tip health tip,4
not angry face pet bunny face angry,4
mr president angry madness go around country consititution,4
not angry face pet bunny face angry,4
anyone become angry easy angry right person right degree right tim,4
sick pollution noise nuisance disturbance year not get rig,4
young bird clam food bird spring angry beautiful nature animal,4
normalize spamming hashtags mad angry ismy right,4
perman hater want per man want pet man india want per man india love per man india support,4
almost boring type tory corruption tory let people die etc etc etc not give angry,4
whoever say angry forever lie,4
war fun certain people magnet sadist loser angry dreamer richard engel,4
mr president angry madness go around country consititution,4
anybody else feel dominic cun ming go drive people angry thrown shelter,4
mr president angry madness go around country consititution,4
think know someone find truth angry,4
mr president angry madness go around country consititution,4
mood cute cat bunny angry mood funny cutie,4
mood cute cat bunny angry mood funny cutie,4
mr president angry madness go around country consititution,4
mr president angry madness go around country consititution,4
mr president angry madness go around country consititution,4
mr president angry madness go around country consititution,4
angry angry anything angry nothing sallust,4
whadidido mad mean angry girlfriend emes girlfriend date fight,4
hate manifestign soooooo much negative energy im homophobic rigjt anger angry wrath war,4
take home angry bean name cat cat kitten kitten kitty pet pet meow,4
anybody else feel dominic cun ming go drive people angry thrown shelter,4
quenda southern brown bandicoot angry sound mix short quenda southern brown bandicoot bandicoot australian animal,4
quenda southern brown bandicoot angry sound mix short quenda southern brown bandicoot bandicoot australian animal,4
ohanlon planet pro,4
need hard type beat check link beat beat star beat lof beat beat mu,4
watch salisbury poisoning catch fuck putin russian disgrace mor,4
adeyemi king please meaning stamp duty first remove naira naira,4
brand ever recover angry,4
not let sun go still angry ephesian sundown angry relax jesus smile real faith te,4
staff barrier almighty star anxious mortal fan,4
adeyemi king please meaning stamp duty first remove naira naira,4
election contest angry zero hedge,4
adeyemi king please meaning stamp duty first remove naira naira,4
adeyemi king please meaning stamp duty first remove naira naira,4
angry rn parler ban good chrisrian mom post reason go guideline,4
adeyemi king please meaning stamp duty first remove naira naira,4
please meaning stamp duty first remove naira naira,4
overwhelmed rn lmao hate fm life suck depression depressed sad mad angry upset frustrate annoy bother km km,4
fa help get art publish come vote click want one galveston texas gal vest,4
firework really annoy dog freak wtf firework angry pus ed,4
angry know,4
wan quick sketch sally love try show emotion sal face even tho litte,4
father suffer alone hospital no advocate ventilator time not allow,4
need hard type beat check link beat beat star beat lof beat beat mu,4
need hard type beat check link beat beat star beat lof beat,4
angry mean karen go wild,4
angry woman pack everything hour take week pack vacation,4
election contest angry via,4
quenda southern brown bandicoot angry sound mix short quenda southern brown bandicoot bandicoot australian animal,4
scar angry mob come carson city give,4
republican let democrat domestic terrorist run sh show,4
terrible inhuman parent told si year ago say put home forget,4
quenda southern brown bandicoot angry sound mix short quenda southern brown bandicoot bandicoot australian animal,4
quenda southern brown bandicoot angry sound mix short quenda southern brown bandicoot bandicoot,4
still angry post,4
get splaining west world score competition angry,4
im angsty preteen anger step hatred angry jess rah mad hate fuck,4
wan quick sketch sally love try show emotion sal face even tho litte,4
steph angsty teen agenda hate red angry scene fuck,4
president trump nominate william perry pendley serve act head bureau land management,4
calm caleb south africa capetown lol angry western cape jo zit stellenbosch,4
angry defeat disease together end nightmare rage reading news lately sick tire,4
not slave mood master angry depressed sore spirit,4
magas angry unhappy must sad go life like angry maga moron rip donald trump,4
angry bird angry bird canary rio gri,4
grrgah gahh shvshs fk looser angst skull im best angry,4
well fargo receive stimulus money must man team foreclose people take adva,4
angry bird angry bird canary rio gri,4
amid covid surge stuck horrible choice start via no wonder,4
amid covid surge stuck horrible choice start via,4
gotta florida weed humor cannabis community de bo comedy weed stag ram humor comedy,4
sudanese asylum seeker disgust act violence angry hungry park inn hotel glasgow well,4
dylan bloodrush think dylan overreact little little comedy show drawed april spe,4
perman hater want per man want pet man india want per man india love per man india support,4
little hog plastic ring around neck hog continued grow despite plastic smell,4
little hog plastic ring around neck hog continued grow despite plastic smell,4
get angry harm already great pain anger help,4
fuck hate kind scummy people fuck guy not get benefit retweet piece,4
limitless side matter life cautious fear critical angry competitive jealous,4
never make decision anger end regret sooner later anger issue angry decision,4
go people covid make people angry,4
sool realistic drawing eye artist twitter sketch sketchbook artist draw realism eye angry serious,4
big dicked bisexual ya get fuck angry confident bisexual funny one liner big dick,4
ani old animation make giggle justin asch animation funny giggle grill cheese cooking silly cute,4
long take get paid token angry electricity bill ume,4
let sum situation almost claim side woman sound like ok google fall woman,4
nole core bring season angry southern gentleman sport shoe,4
help,4
hollow word ben mu lr one insincerity white privilege wip ipo sabbatical vacation angry no,4
wtf endless make film many creatives bipoc gotta hustle big time even get,4
disgust constant lag gameplay fifa online friendly internet conne,4
yeh israel fault feel bit constipate today tbh angry,4
rob baker beast mode strength training fit gym motivation fit fam beard viking power,4
another one day strop contains offensive language beast mode strength training fit ov,4
choked yes really really want part human race,4
angry florida karen scream covid fb theory video via woman,4
president trump nominate william perry pendley serve act head bureau land management,4
realistic drawing eye artist twitter sketch sketchbook artist draw realism eye angry,4
suggestion welcome get rid anger without violent break plate cup etc angry,4
pinner,4
year leak iversery update still search bastard leak test footage onto internet,4
name three angry bird jay jake jim make hope love angry bird angry bird movie,4
dep olor able brit uk demonise scum ia police contribution infr,4
take view not disrespect black pink stay gold view age ago,4
hate unimportant people important unknown tag sad told sad damn depress io,4
someone say im tire please check mentally tire ik tag sad told sad damn depr,4
president trump nominate william perry pendley serve act head bureau land management,4
get angry harm already great pain anger help,4
listen hi white privileged white also get suffocate police officer grandpa jim,4
ani old animation make giggle justin asch animation funny giggle grill cheese cooking silly cute,4
listen hi white privileged white also get suffocate police officer grandpa jim,4
hollow word ben mu lr one insincerity white privilege wip ipo sabbatical vacation,4
specter anger issue mad anime angry art draw story,4
carroll make bad franco bought no whit say angry no th,4
mr president angry madness go around country consititution,4
outright threat eradicate mustang burro earth angry save wildhorse sand burro wild ho,4
angry go go go go go go go go go go next,4
vagrancy comic get comic comic web comic web comic cartoon art humor,4
president trump nominate william perry pendley serve act head bureau land management,4
president trump nominate william perry pendley serve act head bureau land management,4
frack push cfl season year heath wise irrespons,4
president trump nominate william perry pendley serve act head bureau land management,4
insert inspirational quote winter snow tree landscape photography something cooler nature forest,4
president trump nominate william perry pendley serve act head bureau land management,4
still wait frustrate angry poor customer service,4
dr mr monarch check link bio corn nell artist erotic art erotica er tica comic art,4
young desire aloud angry god comfort seem corporal melt,4
dr mr monarch check link bio corn nell artist erotic art erotica er tica comic art,4
outright threat eradicate mustang burro earth angry save wildhorse sand burro,4
president trump nominate william perry pendley serve act head bureau land management,4
president trump nominate william perry pendley serve act head bureau land management,4
president trump nominate william perry pendley serve act head bureau land management,4
president trump nominate william perry pendley serve act head bureau land management,4
hello tony woke sleep angry,4
president trump nominate william perry pendley serve act head bureau land management,4
president trump nominate william perry pendley serve act head bureau land management,4
president trump nominate william perry pendley serve act head bureau land managem,4
actually hearing impaired something right away tell probably,4
actually hearing impaired something right away tell probably,4
virginie despentes make france angry thing change virginie de spent france,4
ahhh honey angry show anger iceberg emotion really feel bu,4
saw lot debri,4
every minute get angry lose sixty second happiness write loud write writer,4
angry say since grinch get elect lol true story,4
bag collect take dog work bit beach clean dog walk take ithome pu,4
organise oh goodness sake organise bust gut day every day corbyn yr labour coup mp,4
organise oh goodness sake organise bust gut day every day corbyn yr labour coup mp,4
organise oh goodness sake organise bust gut day every day corbyn yr labour coup mp,4
organise oh goodness sake organise bust gut day every day corbyn yr labour coup mp,4
organise oh goodness sake organise bust gut day every day corbyn yr labour coup mp,4
organise oh goodness sake organise bust gut day every day corbyn yr labour coup mp,4
organise oh goodness sake organise bust gut day every day corbyn yr labour coup mp,4
organise oh goodness sake organise bust gut day every day corbyn yr labour,4
commission thro furry furry art furry draw digital art digital draw digital art anthropo,4
commission thro furry furry art furry draw digital art digital draw digital art anthropo,4
commission thro furry furry art furry draw digital art digital draw digital art anthropo,4
commission thro furry furry art furry draw digital art digital draw digital art,4
still wait frustrate angry poor customer service,4
set cute bee mascot emoji different face expression angry animal baby,4
guy yell wear mask right outside save north vancouver today realise,4
guy yell wear mask right outside save north vancouver today,4
trump penny take credit hard work american citizen,4
really proud angry mouse less proud wtf cat,4
hopefully reassure action take behaviour see week not tolerate,4
might work angry chat hit,4
black life matter george floyd elijah mcclain murder angry blk athlete etc scoute,4
jeremiah know lord say call prayer answer show,4
happen tamil nadu plain horrific really become barbaric monster must investig,4
never held sweet box become servant shame madam,4
yes still punish speak happen survivor domestic violence attack cyber bull,4
hopefully reassure action take behaviour see week not tolerate,4
yes still punish speak happen survivor domestic violence attack,4
time sleep angry,4
ia angry bird photography eagle bird bird angry wildlife,4
hopefully reassure action take behaviour see week not tolerate,4
absolute joke vodafone week replacement sim card lose post invalid not work,4
stole meme angry,4
frankly tire neglect lot angry,4
hopefully reassure action take behaviour see week not tolera,4
black life matter george floyd elijah mcclain murder angry blk athlete etc bei,4
mr president angry madness go around country consititution,4
absolutely disguise apple customer service rd time send laptop,4
hand look like emo angry meme,4
met people understand everyone else assumes either angry sarcastic hole,4
walk cup presentation angry,4
bag collect take dog work bit beach clean dog walk take ithome pu,4
work whole time often longer hour normal,4
mr president angry madness go around country consititution,4
activity angry worried kid,4
think angry cause make series yet uniform cute girl angry,4
mr president angry madness go around country consititution,4
asia zq excuse speak,4
no broken neck no blood saliva nose mouth no tongue outside mouth something wrong,4
completely fed yes bank service need help frustrate angry,4
bag collect take dog work bit beach clean dog walk,4
tag comment angry humor funny comedy chill good vibe mask co splay,4
yes happen yesterday complete utter selfishness not not social distancin,4
plan blood group health list good bad product health small step back balance,4
angry bby aesthetic trap boy fem boy fem boy friday angry cute co splay,4
shock scene bournemouth last couple day age really,4
ban section beach till october human pick leave no waste rubbish human,4
hate say feel like man city absolutely turn sunday angry fac,4
mr president angry madness go around country consititution,4
like everyone else give thing year becasue coronavirus no,4
mr president angry madness go around country consititution,4
mr president angry madness go around country consititution,4
mr president angry madness go around country consititution,4
mr president angry madness go around country consititution,4
mr president angry madness go around country consititution,4
mr president angry madness go around country consititution,4
mr president angry madness go around country consititution,4
mr president angry madness go around country consititution,4
wan quick sketch sally love try show emotion sal face even tho litte,4
go nearly four month isolation moron risk second wave covid heard,4
specter anger issue mad anime angry art draw story,4
specter anger issue mad anime angry art draw story,4
anger issue mad anime angry art draw story,4
know feel angry picture anyone retro game retro nintendo,4
enough ea angry,4
disabled old new truth knew still reckon diagnosis,4
zealot conviction laid bare believe lt expletive delete gt tool around maryland co,4
know friend feel like no one talk shit go head unknown ignore tag,4
angry angry ppl respect show true color administration angry,4
reminder ever make knee beg make like fool feel heart angry,4
finish one angriest mini workout ever angry workout fitness author storyteller hawaii,4
yes angry save community use,4
know feel angry picture anyone retro game retro nintendo,4
dylan ipad account upset confuse angry,4
road rage happens idiot awake angry rage idiot full throttle tv,4
expect trump veto pout mop golfing angry vengeful trump not well,4
single handedly try turn nevada back red seem way lose lot voter,4
yes angry save community use,4
yes angry save community use,4
local drunk get really angry able drink beer th pint forgotten face mask,4
think abt seijoh loss feel angry mad upset resentful,4
think abt seijoh loss feel angry mad upset resentful,4
yes desperate make even dangerous ugly summer ang,4
yes desperate make even dangerous ugly summer ang,4
write blog frustration wear mask sure read end get punchline,4
wan quick sketch sally love try show emotion sal face even tho litte,4
friend family meanwhile back farm state report spike state report record daily number,4
fuck ask opinion go reject especially parrot say yesterday piss angry,4
logo sale logo logo logo design logo designer sale sale animal bird owl night dark,4
thanks melissa reef really consider not watch day four life anymore racist angry,4
yes desperate make even dangerous ugly summer ang,4
single handedly try turn nevada back red seem way lose lot voter,4
single handedly try turn nevada back red seem way lose lot voter,4
single handedly try turn nevada back red seem way lose lot voter,4
single handedly try turn nevada back red seem way lose lot,4
still lose tenner angry,4
wan quick sketch sally love try show emotion sal face even tho litte,4
yesterday wife crashed flyer bike part pant get caught disk brake danger ou,4
yes desperate make even dangerous ugly summer ang,4
spoke lovely lady phone afternoon promise email back today either way,4
covid make angry upset bitter like everybody else want damn pandemic end frustrate,4
like bearer bad news tell bad news fuck bearer bad news mean tamara thi,4
yes desperate make even dangerous ugly summer ang,4
like wally oh wait wally picture beach angry,4
know friend feel like no one talk shit go head unknown ignore tag,4
imagine lose ur best friend hit bad lose ur partner tag sad told sad damn depression fear,4
reason keep thing cause im not good explain tag sad told sad damn depression,4
ban section beach till october human pick leave no waste rubbish human,4
yes desperate make even dangerous ugly summer ang,4
yes desperate make even dangerous ugly summer ang,4
yes desperate make even dangerous ugly summer ang,4
yes desperate make even dangerous ugly summer ang,4
yes desperate make even dangerous ugly summer,4
instead teach use history not repeat want erase,4
wan quick sketch sally love try show emotion sal face even tho litte,4
wan quick sketch sally love try show emotion sal face even tho litte,4
wolf draw fun mini vacation angry cry procreate art,4
culture man measure language us sad woman angry,4
call today angry worried glom depressed depression awareness depression helpline free talk clinic cic,4
call today angry worried glom depressed depression awareness depression helpline free talk clinic cic,4
tjsully upcoming scene chapter magic action hash ino web toon comic web comic thursday morning anime manga angry mad,4
upcoming scene chapter magic action hash ino web toon comic web comic thursday morning anime manga,4
wolf draw fun mini vacation angry cry procreate art,4
know time twitter break find anything positive story,4
ah maud arber heart today much pain family feel men shot unarmed man jogging,4
best fighter never angry lao tzu anger fighter angry lao tzu quote,4
dangerous irony people angry others incompetence amit kalantri,4
healeth thee prayer angry prayer book heal anger,4
dil chara big screen dil chara big screen shame indian public see tragedy still wa,4
wan quick sketch sally love try show emotion sal face even tho litte,4
wan quick sketch sally love try show emotion sal face even tho litte,4
wan quick sketch sally love try show emotion sal face even tho litte,4
wan quick sketch sally love try show emotion sal face even tho litte,4
wan quick sketch sally love try show emotion sal face even tho litte,4
really wipe angry,4
wan quick sketch sally love try show emotion sal face even tho litte,4
wan quick sketch sally love try show emotion sal face even tho,4
sarkar angry look,4
perman hater want per man want pet man india want per man india love per man india support,4
draw fun mini vacation angry cry procreate art,4
anger consequence anger angry,4
open studio surgical environment somehow ok angry tattooist miss job,4
deputy speaker na qasim suri get angry ajmal khan use word peerni aj mal angry deputy,4
not work not bad support page call say busy,4
register intolerance quotient recognition calculator irritant guilty charge,4
homeless kettle complain landlady brought kettle som,4
ever want slime pet blue slime epic swag anger angry rain,4
ban section beach till october human pick leave no waste rubbish,4
work person angry depression,4
not punish anger punish anger buddha anger love anxiety,4
see horrible story outrageous disgust behaviour totally not acceptable,4
see horrible story outrageous disgust behaviour totally not acceptable,4
see horrible story outrageous disgust behaviour totally not acceptable,4
see horrible story outrageous disgust behaviour totally not acceptable,4
